original_name,genre_ids,name,popularity,origin_country,vote_count,first_air_date,backdrop_path,original_language,id,vote_average,overview,poster_path
The End of the F***ing World,"[35, 80, 18]",The End of the F***ing World,31.692,['GB'],395,2017-10-24,/qBw99h23veY7bTccAzV4bRCg86n.jpg,en,74577,8.0,"James is 17 and is pretty sure he is a psychopath. Alyssa, also 17, is the cool and moody new girl at school. The pair make a connection and she persuades him to embark on a darkly comedic road trip in search of her real father.",/vZQKQcB5n91c6tBofAVXq88Uuti.jpg
Downton Abbey,[18],Downton Abbey,37.695,['GB'],387,2010-09-26,/8qX4SmXz99Iunils650JpRbW4iR.jpg,en,33907,8.1,"A chronicle of the lives of the aristocratic Crawley family and their servants in the post-Edwardian era—with great events in history having an effect on their lives and on the British social hierarchy.

",/tlbS1mqX2x5lVSyuxfTwDPwnTmD.jpg
Titans,"[18, 10759, 10765]",Titans,69.007,['US'],393,2018-10-12,/7DE9KC9GyY2TUJMnSPgYJG3rafw.jpg,en,75450,7.7,A team of young superheroes led by Nightwing (formerly Batman's first Robin) form to combat evil and other perils.,/eeHI5iBSCOxj4HGSOmFM6azBmwb.jpg
Deadwood,"[80, 18, 37]",Deadwood,24.811,['US'],388,2004-03-21,/vg6j3QrZWjabZAt16j3ayKDhOh5.jpg,en,1406,8.2,"The story of the early days of Deadwood, South Dakota; woven around actual historic events with most of the main characters based on real people. Deadwood starts as a gold mining camp and gradually turns from a lawless wild-west community into an organized wild-west civilized town. The story focuses on the real-life characters Seth Bullock and Al Swearengen.",/M8HjXeXQy4Ta4MOrCmMHLr8pBl.jpg
Chuck,"[35, 18, 10759]",Chuck,168.742,['US'],385,2007-09-24,/umwxuvelfTnglH2Xkj8khu0pf5r.jpg,en,1404,7.6,"When Buy More computer geek Chuck Bartowski unwittingly downloads a database of government information and deadly fighting skills into his head, he becomes the CIA's most vital secret. This sets Chuck on a path to become a full-fledged spy.",/rrrtSMsjEor0S45Ef5AJpNAgWPD.jpg
The OA,"[10765, 9648, 18]",The OA,30.82,['US'],382,2016-12-16,/eceERFCjdYEDPDQpVBreukypTI8.jpg,en,69061,7.4,"Prairie Johnson, blind as a child, comes home to the community she grew up in with her sight restored. Some hail her a miracle, others a dangerous mystery, but Prairie won’t talk with the FBI or her parents about the seven years she went missing.",/rueY4slMeKtTGitm0raFUJvgaa5.jpg
Banshee,"[80, 18, 10759]",Banshee,21.231,['US'],383,2013-01-11,/rvk7SMZRKR5BxDAxZmR5RF666uC.jpg,en,41727,8.0,Banshee is an American drama television series set in a small town in Pennsylvania Amish country and features an enigmatic ex-con posing as a murdered sheriff who imposes his own brand of justice while also cooking up plans that serve his own interests.,/fvocBFChMERoxWb7MMuTsUqWEis.jpg
Lethal Weapon,"[80, 18, 10759]",Lethal Weapon,37.017,['US'],378,2016-09-21,/yqZ5ACKeNJ30mylUEzvtWZu4pGU.jpg,en,67116,7.2,A slightly unhinged former Navy SEAL lands a job as a police officer in Los Angeles where he's partnered with a veteran detective trying to keep maintain a low stress level in his life.,/jbMZkxLHVDSKiZh0HppCthRW96k.jpg
BoJack Horseman,"[16, 35, 18]",BoJack Horseman,58.995,['US'],376,2014-08-22,/qFYDJUIFh8zgEDy3EvnHwhgOl0S.jpg,en,61222,8.1,"Meet the most beloved sitcom horse of the 90s - 20 years later. BoJack Horseman was the star of the hit TV show ""Horsin' Around,"" but today he's washed up, living in Hollywood, complaining about everything, and wearing colorful sweaters.",/1bnrSsJNejoQq8lGBDECQroGjPz.jpg
I Am Not an Animal,"[16, 35]",I Am Not an Animal,10.238,['GB'],378,2004-05-10,/ok1YiumqOCYzUmuTktnupOQOvV5.jpg,en,100,9.4,"I Am Not An Animal is an animated comedy series about the only six talking animals in the world, whose cosseted existence in a vivisection unit is turned upside down when they are liberated by animal rights activists.",/nMhv6jG5dtLdW7rgguYWvpbk0YN.jpg
Charmed,"[35, 18, 9648]",Charmed,81.988,['US'],371,1998-10-07,/6IJI9L4ZA33ydSHVZuXrPCJpemW.jpg,en,1981,7.2,"Three sisters (Prue, Piper and Phoebe) reunite and unlock their powers to become the Charmed Ones, the most powerful good witches of all time, whose prophesied destiny is to protect innocent lives from evil beings such as demons and warlocks. Each sister possesses unique magical powers that grow and evolve, while they attempt to maintain normal lives in modern day San Francisco. ",/z4bPJ1BWU2EtV69NII2GVvsugQ2.jpg
ドラゴンボール,"[16, 35, 10759, 10765]",Dragon Ball,94.998,['JP'],373,1986-02-26,/iflq7ZJfso6WC7gk9l1tD3unWK.jpg,ja,12609,7.1,"Long ago in the mountains, a fighting master known as Gohan discovered a strange boy whom he named Goku. Gohan raised him and trained Goku in martial arts until he died. The young and very strong boy was on his own, but easily managed. Then one day, Goku met a teenage girl named Bulma, whose search for the mystical Dragon Balls brought her to Goku's home. Together, they set off to find all seven and to grant her wish.",/3wx3EAMtqnbSLhGG8NrqXriCUIQ.jpg
12 Monkeys,"[18, 878]",12 Monkeys,25.974,['US'],372,2015-01-16,/hCl5HObevnBr0M2FwGUxp93GciK.jpg,en,60948,6.9,"The provocative story of Cole, a time traveler from a decimated future in a high-stakes race against the clock. Utilizing a dangerous and untested method of time travel, he journeys from 2043 to the present day on a mission to locate and eradicate the source of a deadly plague that will all but annihilate the human race.",/taoncu2TKk88hqNauPLKmIRfwrO.jpg
Mr. Bean,"[35, 10751]",Mr. Bean,27.446,['GB'],370,1990-01-01,/ipmv6lzVcsLqJOUHu11mvcqYDa9.jpg,en,4327,7.9,Mr Bean turns simple everyday tasks into chaotic situations and will leave you in stitches as he creates havoc wherever he goes.,/pUNQV35kDaKuejnXGNiUeEBurNE.jpg
Battlestar Galactica,"[18, 10759, 10765]",Battlestar Galactica,12.906,[],372,2003-12-08,/gGpR3aTScvCqgDpxSQRj3kj0Dfc.jpg,en,71365,8.2,"A re-imagining of the original series in which a ""rag-tag fugitive fleet"" of the last remnants of mankind flees pursuing robots while simultaneously searching for their true home, Earth.",/imTQ4nBdA68TVpLaWhhQJnb7NQh.jpg
Planet Earth II,[99],Planet Earth II,20.365,['GB'],373,2016-11-06,/xIt4DDYipMPNu2HDBrhUS4ndSYb.jpg,en,68595,8.3,David Attenborough presents a documentary series exploring how animals meet the challenges of surviving in the most iconic habitats on earth.,/uy5QoTu8fc6fGXMCTMbpQJFUEB0.jpg
This Is Us,"[35, 18]",This Is Us,41.578,['US'],366,2016-09-20,/shJhgNuC2a4hPdqvm8IDXFvYwLx.jpg,en,67136,7.9,"Follows the lives and families of three adults living and growing up in the United States of America in present and past times. As their paths cross and their life stories intertwine in curious ways, we find that several of them share the same birthday - and so much more than anyone would expect.",/9oYpkVSbjX8TXifdAW0a5ek8XsW.jpg
The Night Of,"[80, 18, 9648]",The Night Of,29.094,['US'],365,2016-07-10,/a4IHGvDYVRr7rhquhtvpyOZBbR8.jpg,en,66276,7.8,"After a night of partying with a female stranger, a man wakes up to find her stabbed to death and is charged with her murder.",/7FBeSojeyiTMgIxm6QPUVzpDP93.jpg
The Shannara Chronicles,"[10759, 10765]",The Shannara Chronicles,20.697,['US'],366,2016-01-05,/72I0EdBw1a8lv1ev2AqXmxOEFUm.jpg,en,64122,6.7,A young Healer armed with an unpredictable magic guides a runaway Elf in her perilous quest to save the peoples of the Four Lands from an age-old Demon scourge.,/bYq2R7V9r69pWGOqXOnaJtmmtQ8.jpg
CSI: Crime Scene Investigation,"[80, 18, 9648]",CSI: Crime Scene Investigation,173.269,['US'],354,2000-10-06,/nHaUMYpZ8qtLinqFXbgZoL9orHT.jpg,en,1431,7.0,"A Las Vegas team of forensic investigators are trained to solve criminal cases by scouring the crime scene, collecting irrefutable evidence and finding the missing pieces that solve the mystery.",/uWbzg2cAKiNrpCxOLPwmzdrRHUS.jpg
Top Gear,[99],Top Gear,103.109,['GB'],352,2002-10-20,/ag2oZaayXrPL7XFEre5x4rBrxue.jpg,en,45,7.4,The hosts talk about the latest cars and its specifications. They review the performance of the car and also find out if it is as good as the manufacturers claim. The current hosts are Chris Evans and Matt LeBlanc with The Stig.,/sYx1OktL5q8kvRCuZ8Pccg8xLBy.jpg
SpongeBob SquarePants,"[16, 35, 10751, 10765]",SpongeBob SquarePants,10.307,['US'],352,1999-05-01,/cGtlhNEAn7kkDzBsr4lXUOVmFYW.jpg,en,387,7.1,"Deep down in the Pacific Ocean in the subterranean city of Bikini Bottom lives a square yellow sponge named SpongeBob SquarePants. SpongeBob lives in a pineapple with his pet snail, Gary, loves his job as a fry cook at the Krusty Krab, and has a knack for getting into all kinds of trouble without really trying. When he's not getting on the nerves of his cranky next door neighbor Squidward, SpongeBob can usually be found smack in the middle of all sorts of strange situations with his best buddy, the simple yet lovable starfish, Patrick, or his thrill-seeking surfer-girl squirrel pal, Sandy Cheeks.",/zDuKxQkG8EemvLdBn43ChdM0MJL.jpg
The Gifted,"[18, 10759, 10765]",The Gifted,50.4,['US'],350,2017-10-02,/18inwHlpKnK9mt02wFBJoIVKXI.jpg,en,69629,7.0,"A suburban couple's ordinary lives are rocked by the sudden discovery that their children possess mutant powers. Forced to go on the run from a hostile government, the family joins up with an underground network of mutants and must fight to survive.",/nshCqszjTNuqhrB53vrSqWO18sE.jpg
ドラゴンボールゼット,"[16, 35, 10759, 10765]",Dragon Ball Z,102.266,['JP'],348,1989-04-26,/ydf1CeiBLfdxiyNTpskM0802TKl.jpg,ja,12971,8.0,"Five years have passed since the fight with Piccolo Jr., and Goku now has a son, Gohan. The peace is interrupted when an alien named Raditz arrives on Earth in a spacecraft and tracks down Goku, revealing to him that that they are members of a near-extinct warrior race called the Saiyans.",/lCvOCn1Hq0ugBL6T8SyMoaCWNOc.jpg
Weeds,"[35, 80, 18]",Weeds,77.603,['US'],347,2005-08-07,/OvcQyv9RJscwq2KuuWWAuRPjYt.jpg,en,186,7.1,"Weeds is an American dark comedy-drama series created by Jenji Kohan. The central character is Nancy Botwin, a widowed mother of two boys who begins selling cannabis to support her family after her husband dies suddenly of a heart attack. Over the course of the show, she and her family become increasingly entangled in illegal activities.",/uYZ0hzw4eNHUWtEsH18pstsuefG.jpg
Dr. Horrible's Sing-Along Blog,"[35, 18, 10765]",Dr. Horrible's Sing-Along Blog,10.141,['US'],342,2008-07-15,/yFaa6UTu1IpV22EY20TcEL0dUrk.jpg,en,5739,7.6,"Aspiring super-villain Dr. Horrible wants to join the Evil League of Evil and win the girl of his dreams, but his nemesis, Captain Hammer, stops him at every turn.",/zlAjTMaWakkoJidwsYO0QNwtPqy.jpg
Continuum,"[10759, 18, 10765]",Continuum,32.147,['CA'],343,2012-05-27,/pyg6Po8MZlUJOt6gFkzneXxvtaW.jpg,en,43020,7.4,"The series centers on the conflict between a group of rebels from the year 2077 who time-travel to Vancouver, BC, in 2012, and a police officer who accidentally accompanies them. In spite of being many years early, the rebel group decides to continue its violent campaign to stop corporations of the future from replacing governments, while the police officer endeavours to stop them without revealing to anyone that she and the rebels are from the future.",/iRgMaN9wkQEhdqENhDCZWCJnNWW.jpg
Batman: The Animated Series,"[16, 18, 9648, 10759]",Batman: The Animated Series,33.873,['US'],343,1992-09-05,/vbQk48WQzuGWgTGDedaY3UZea12.jpg,en,2098,8.2,"Batman: The Animated Series is an American animated television series based on the DC Comics superhero Batman. The series was widely praised for its thematic complexity, dark tone, artistic quality, and faithfulness to its title character's crime-fighting origins.",/ePf3sBX5FjnUEtXERVWZJGsSPu7.jpg
Misfits,"[35, 18, 10765]",Misfits,16.963,['GB'],338,2009-11-12,/3I73H6nrYg0ye4L40qTFnVgXGve.jpg,en,31295,7.7,"When five young outsiders on Community Service get caught in a strange storm, they discover that they have developed superpowers.",/9IZAi5aVVLx7Uvk7jfu7z2fC3bf.jpg
Quantico,"[80, 18, 9648]",Quantico,34.522,['US'],340,2015-09-27,/se0EYO34UNsOw30dEzxu5Bkt0wb.jpg,en,62816,6.1,"A diverse group of recruits has arrived at the FBI Quantico Base for training. They are the best, the brightest and the most vetted, so it seems impossible that one of them is suspected of masterminding the biggest attack on New York City since 9/11.",/3ofY2mALEiE0QDyRlVOV3sDNMYC.jpg
The Good Place,"[35, 10765]",The Good Place,48.628,['US'],341,2016-09-19,/64BUMjqFnfs3qKKQtwOHPIz224f.jpg,en,66573,7.9,"Eleanor Shellstrop, an ordinary woman who, through an extraordinary string of events, enters the afterlife where she comes to realize that she hasn't been a very good person. With the help of her wise afterlife mentor, she's determined to shed her old way of living and discover the awesome (or at least the pretty good) person within.",/eFV0O3u0CbVdhEYIozea4iZRn3O.jpg
Gravity Falls,"[16, 35, 9648, 10765]",Gravity Falls,70.561,['US'],337,2012-06-15,/sJjrJWsOCUUeVMexxANNC6s3dWV.jpg,en,40075,8.3,"Twin brother and sister Dipper and Mabel Pines are in for an unexpected adventure when they spend the summer helping their great uncle Stan run a tourist trap in the mysterious town of Gravity Falls, Oregon.",/oGsgxjeZ9rd20eCJsGSMGgWvl4P.jpg
Wayward Pines,"[18, 9648, 10765]",Wayward Pines,12.519,['US'],333,2015-05-14,/abYmoifJHK2h6i4L4NatiqOCd68.jpg,en,53425,6.7,"Imagine the perfect American town... beautiful homes, manicured lawns, children playing safely in the streets. Now imagine never being able to leave. You have no communication with the outside world. You think you're going insane. You must be in Wayward Pines.",/dlGyl2HuB1RFHhMtHOI8WKnR5qY.jpg
The Grand Tour,[99],The Grand Tour,33.647,['GB'],328,2016-11-18,/qnmd44b2gPFxZTEZ8CG0fyOgKjD.jpg,en,67557,7.8,"Jeremy Clarkson, Richard Hammond and James May are back with a show about adventure, excitement and friendship... as long as you accept that the people you call friends are also the ones you find extremely annoying. Sometimes it's even a show about cars. Follow them on their global adventure.",/4bRY1FiDcLnpwJAELYOLinL3fIp.jpg
Star Trek: Deep Space Nine,"[10759, 18, 10765]",Star Trek: Deep Space Nine,102.024,['US'],324,1993-01-03,/jB3Ksk1tvhksdTa0xvI7l4LFHsy.jpg,en,580,7.8,"At Deep Space Nine, a space station located next to a wormhole in the vicinity of the liberated planet of Bajor, Commander Sisko and crew welcome alien visitors, root out evildoers and solve all types of unexpected problems that come their way.",/amrjHOaXxkeVgSrVS0CVmqb3xhR.jpg
Sleepy Hollow,"[18, 9648, 10765]",Sleepy Hollow,45.865,['US'],324,2013-09-16,/1XsLGduUcuxBiTLEfQrkikfKtZy.jpg,en,50825,6.7,Ichabod Crane is resurrected and pulled two and a half centuries through time to unravel a mystery that dates all the way back to the founding fathers.,/ibgtOccXy0O8siMDowlEA9uWhe8.jpg
Monk,"[18, 9648, 80, 35]",Monk,128.652,['US'],323,2002-07-12,/gDzIxYE6XcSFbQx0Fi8TBSzME0w.jpg,en,1695,7.7,"Adrian Monk was once a rising star with the San Francisco Police Department, legendary for using unconventional means to solve the department's most baffling cases. But after the tragic (and still unsolved) murder of his wife Trudy, he developed an extreme case of obsessive-compulsive disorder. Now working as a private consultant, Monk continues to investigate cases in the most unconventional ways.",/zB14YMGLLlNVzUuNX0heKEgJ708.jpg
The Haunting,"[18, 9648]",The Haunting,38.769,['US'],325,2018-10-12,/dQF17lG4OZ3pC4QD9iNjaMS96gO.jpg,en,72844,8.2,"The Crains, a fractured family, confront haunting memories of their old home and the terrifying events that drove them from it.",/38PkhBGRQtmVx2drvPik3F42qHO.jpg
Billions,[18],Billions,63.182,['US'],321,2016-01-17,/6f3s7NbujF9NGBIdBQhRJcZAbFy.jpg,en,62852,7.7,"A complex drama about power politics in the world of New York high finance. 

Shrewd, savvy U.S. Attorney Chuck Rhoades and the brilliant, ambitious hedge fund king Bobby ""Axe"" Axelrod are on an explosive collision course, with each using all of his considerable smarts, power and influence to outmaneuver the other. The stakes are in the billions in this timely, provocative series.",/fTCSDJbmRbW23LSGcbfM0OTrtyR.jpg
Star Trek: Enterprise,"[18, 10759, 10765]",Star Trek: Enterprise,99.423,['US'],323,2001-09-26,/ibjUCp1dFK7kmMUcXrb1vW8PfHc.jpg,en,314,7.5,"During the mid-22nd century, a century before Captain Kirk's five-year mission, Jonathan Archer captains the United Earth ship Enterprise during the early years of Starfleet, leading up to the Earth-Romulan War and the formation of the Federation.",/3msta8aYp2309onnFkVXeohbN4w.jpg
Freaks and Geeks,"[35, 18]",Freaks and Geeks,25.692,['US'],323,1999-09-25,/22VvTFx8FI2BYxQusErS8zfwH5D.jpg,en,2382,8.2,"High school mathlete Lindsay Weir rebels and begins hanging out with a crowd of burnouts (the ""freaks""), while her brother Sam Weir navigates a different part of the social universe with his nerdy friends (the ""geeks"").",/dUNouwAjgUne3DajpTzuTZBIops.jpg
White Collar,"[80, 18]",White Collar,85.948,['US'],322,2009-10-23,/3ThiHR3HK1A62GkteYROTpexoOS.jpg,en,21510,7.9,"Neal Caffrey, a con man, forger and thief, is captured after a three-year game of cat and mouse with the FBI. With only months left serving a four-year sentence, he escapes to look for Kate, his girlfriend. Peter Burke, the FBI agent who initially captured Caffrey, finds and returns him to prison. This time, Caffrey proposes a deal with the FBI, as part of a work-release program. After some hesitation, Burke agrees, and thus begins this unconventional arrangement where Caffrey helps Burke apprehend white collar criminals.",/wsD09ud4IhG3G4ZMIfyu05HHEJh.jpg
30 Rock,[35],30 Rock,61.675,['US'],320,2006-10-11,/cK5AbLFBY2JDoqEdVXk0697e2SV.jpg,en,4608,7.2,"30 Rock is an American television comedy series that ran on NBC from October 11, 2006, to January 31, 2013, and was created by Tina Fey. The series, which is loosely based on Fey's experiences as head writer for Saturday Night Live, takes place behind the scenes of a fictional live sketch comedy series depicted as airing on NBC. The series' name refers to 30 Rockefeller Plaza in New York City, the address of the GE Building, in which the NBC Studios are located.",/k3RbNzPEPW0cmkfkn1xVCTk3Qde.jpg
The Crown,[18],The Crown,29.16,"['GB', 'US']",319,2016-11-04,/p3qBwzzLe9aw1yA0s4hg0M2DvD0.jpg,en,65494,8.1,"The gripping, decades-spanning inside story of Her Majesty Queen Elizabeth II and the Prime Ministers who shaped Britain's post-war destiny. 

The Crown tells the inside story of two of the most famous addresses in the world – Buckingham Palace and 10 Downing Street – and the intrigues, love lives and machinations behind the great events that shaped the second half of the 20th century. Two houses, two courts, one Crown.",/uT4HL776Up8LgjqfmmGtGKSDgvT.jpg
Timeless,"[18, 10759, 10765]",Timeless,75.036,['US'],316,2016-10-03,/hgzI30LbVNSgxJcgDOs3hqshJD2.jpg,en,66786,7.2,"A mysterious criminal steals a secret state-of-the-art time machine, intent on destroying America as we know it by changing the past. Our only hope is an unexpected team: a scientist, a soldier and a history professor, who must use the machine's prototype to travel back in time to critical events. While they must make every effort not to affect the past themselves, they must also stay one step ahead of this dangerous fugitive. But can this handpicked team uncover the mystery behind it all and end his destruction before it's too late?",/wFaS9kROwztTWNxIKBbOLwIgApV.jpg
Broadchurch,"[80, 18, 9648]",Broadchurch,14.683,['GB'],316,2013-03-04,/zo75wtgVsbh8YoI6sYN2thwFFJm.jpg,en,1427,8.0,"The murder of a young boy in a small coastal town brings a media frenzy, which threatens to tear the community apart.",/f5gQRyTZ3v4asugU2F5HXE2FIDg.jpg
Justified,"[80, 18, 9648]",Justified,58.47,['US'],315,2010-03-16,/chYA7LQVESXOHdtE0ocGm6344TM.jpg,en,1436,8.0,"A character drama based on the 2001 Elmore Leonard short story ""Fire in the Hole."" Leonard's tale centers around U.S. Marshal Raylan Givens of Kentucky, a quiet but strong-willed official of the law. The tale covers his high-stakes job, as well as his strained relationships with his ex-wife and father.",/pv3OcewyqMpnIZUOSTxiFnSJaki.jpg
Colony,"[878, 18]",Colony,82.585,['US'],314,2016-01-14,/xfjItSUIahhEIRCOcMBbp5Q0alx.jpg,en,62858,6.7,"In the near future a family must make difficult decisions as they balance staying together with trying to survive. They live in Los Angeles, which has been occupied by a force of outside intruders.  While some people have chosen to collaborate with the authorities and benefit from the new order, others have rebelled — and suffer the consequences.",/qfS0mp22XfTig2EK3jWKiyx7kNy.jpg
The Last Man on Earth,"[35, 18]",The Last Man on Earth,19.352,['US'],314,2015-03-01,/q8FS5ZtkV98MYbUR1wJRyvVJGav.jpg,en,61888,6.6,"The year is 2022, and after an unlikely event, only one man is left on earth: Phil Miller, who used to be just an average guy who loved his family and hated his job at the bank. Now, in his RV, Phil searches the country for other survivors.",/9TcvdOIBEnIDXbLvFUKluRDa3tZ.jpg
Limitless,"[80, 18, 10759, 10765]",Limitless,31.634,['US'],314,2015-09-22,/6X9pyhrKSy0zEpqpBBlaLZdULLv.jpg,en,62687,7.1,"Limitless, based on the feature film, picks up where the movie left off and follows Brian Sinclair as he discovers the power of the mysterious drug NZT, and is coerced into using his newfound drug-enhanced abilities to solve weekly cases for the FBI.",/ieXc6ryp53DGOv9X3PFhTvTtLau.jpg
Chicago P.D.,"[80, 18]",Chicago P.D.,86.926,['US'],313,2014-01-08,/euv0fNNFfOFVd314c17pup96Bgj.jpg,en,58841,7.6,"A riveting police drama about the men and women of the Chicago Police Department's District 21 who put it all on the line to serve and protect their community. District 21 is made up of two distinctly different groups: the uniformed cops who patrol the beat and go head-to-head with the city's street crimes and the Intelligence Unit that combats the city's major offenses - organized crime, drug trafficking, high profile murders and beyond.",/pYpstkuLMEWfIt9Lp69w4DAb6M4.jpg
Fawlty Towers,[35],Fawlty Towers,20.796,['GB'],310,1975-09-19,/6f1nH8U4kT9GaOYezYiG1CJYL9p.jpg,en,2207,8.2,"Fawlty Towers is a British sitcom produced by BBC Television that was first broadcast on BBC2 in 1975 and 1979. Twelve episodes were made. The show was written by John Cleese and his then wife Connie Booth, both of whom also starred in the show.

The series is set in Fawlty Towers, a fictional hotel in the seaside town of Torquay, on the ""English Riviera"". The plots centre around tense, rude and put-upon owner Basil Fawlty, his bossy wife Sybil, a comparatively normal chambermaid Polly, and hapless Spanish waiter Manuel and their attempts to run the hotel amidst farcical situations and an array of demanding and eccentric guests.

In a list drawn up by the British Film Institute in 2000, voted by industry professionals, Fawlty Towers was named the best British television series of all time.",/mI2KKCCgysG3JX39BM2C8zfqanV.jpg
The Twilight Zone,"[18, 9648, 10765]",The Twilight Zone,60.518,['US'],309,1959-10-02,/lKdKgLoLPmnHoUXunrcSAuBhAJx.jpg,en,6357,8.3,"A series of unrelated stories containing drama, psychological thriller, fantasy, science fiction, suspense, and/or horror, often concluding with a macabre or unexpected twist.",/7uY4pCOxbEdv4M8jTE4uMPVoSIW.jpg
Last Week Tonight with John Oliver,"[10767, 35]",Last Week Tonight with John Oliver,45.754,['US'],310,2014-04-27,/8RmG1tZJwAOC45A9waK19v5xjbe.jpg,en,60694,7.9,"A half-hour satirical look at the week in news, politics and current events.",/yz8g7Y85hyTPXwd7DfRjEWgYLUr.jpg
American Crime Story,"[80, 18]",American Crime Story,66.097,['US'],308,2016-02-02,/j8NSaQJqnSOx8vsxwEukY3oATNj.jpg,en,64513,7.2,An anthology series centered around some of history's most famous criminals.,/pBWaprChfKyZR0uY5qFKKTnlsPE.jpg
Z Nation,"[18, 9648, 10759]",Z Nation,24.775,['US'],308,2014-09-12,/jCvwvSH5i9bLaql1rR21j9U9LS.jpg,en,61345,6.5,"Three years after the zombie virus has gutted the country, a team of everyday heroes must transport the only known survivor of the plague from New York to California, where the last functioning viral lab waits for his blood.",/gXfeDMkEcHoYBvtkbU11g3F81b.jpg
Alias,"[10759, 18]",Alias,14.34,['US'],307,2001-09-30,/4eufRkflTkrmmONcswo02A4S6en.jpg,en,2046,6.2,"Sydney Bristow, an agent who has been tricked to believe she is working for the U.S. government, is actually working for a criminal organization named the Alliance of Twelve. Upon learning this, Sydney becomes a double agent for the real CIA.",/bMj6iM7TBcceG44vpireA2Axeab.jpg
My Name Is Earl,[35],My Name Is Earl,35.503,['US'],311,2005-09-20,/nst2omyAbPABkcfOnupVrdfZNeN.jpg,en,2317,7.3,"When petty criminal Earl Hickey wins the lottery, he sets off on a quest to repair his questionable karma.",/57shLTTkHvhLUhyP1t0lNZPoAxD.jpg
The Boys,"[10759, 10765]",The Boys,74.112,['US'],316,2019-07-25,/bI37vIHSH7o4IVkq37P8cfxQGMx.jpg,en,76479,8.1,A group of vigilantes known informally as “The Boys” set out to take down corrupt superheroes with no more than blue-collar grit and a willingness to fight dirty.,/dzOxNbbz1liFzHU1IPvdgUR647b.jpg
Chicago Fire,[18],Chicago Fire,101.248,['US'],306,2012-10-10,/gdIFeiJGsywKt6scyILMZI1tMl4.jpg,en,44006,7.6,"An edge-of-your-seat view into the lives of everyday heroes committed to one of America's noblest professions. For the firefighters, rescue squad and paramedics of Chicago Firehouse 51, no occupation is more stressful or dangerous, yet so rewarding and exhilarating. These courageous men and women are among the elite who forge headfirst into danger when everyone else is running the other way and whose actions make the difference between life and death.",/g9aoiYLbE3IrDiMms5fU4lv6BR4.jpg
